breed,interesting
affenpinscher,The Affenpinscher with its monkey-like appearance fearless terrier spirit and affectionate nature is a small yet charismatic breed that has captured hearts with its unique charm and big personality.
afghan_hound,The Afghan Hound renowned for its breathtaking beauty and elegant demeanor is a regal and ancient breed originating from the mountainous regions of Afghanistan; characterized by its silky flowing coat distinctive topknot and aristocratic posture this sighthound not only excels in grace and agility but also possesses a dignified aloofness captivating the hearts of dog enthusiasts and earning its place as a captivating aristocratic companion.
african_hunting_dog,The African Hunting Dog also known as the African Wild Dog or Painted Wolf is a remarkable and highly social canid species native to sub-Saharan Africa distinguished by its striking and vibrant coat patterns formidable hunting prowess through cooperative pack strategies and a complex intricate social structure that underscores the species' adaptability and resilience in the challenging African wilderness.
airedale,The Airedale Terrier often referred to as the "King of Terriers" is a versatile and sturdy breed with a distinctive tan and black coat renowned for its intelligence loyalty and remarkable trainability making it not only an excellent working dog but also a loving and devoted family companion.
american_staffordshire_terrier,The American Staffordshire Terrier characterized by its muscular build and endearing affectionate nature stands as a testament to its historical roles as a farm guardian and loyal family pet showcasing a unique blend of strength agility and a gentle temperament that has earned it a place as a cherished and misunderstood breed.
appenzeller,The Appenzeller a lesser-known Swiss mountain dog from the Sennenhund family impresses with its striking tricolor coat marked intelligence and herding instincts serving as both a dedicated working dog and a loving family member embodying the quintessential traits of Swiss mountain breeds.
australian_terrier,The Australian Terrier originating from Down Under is a spirited and tenacious small breed known for its rough coat that offers protection against harsh weather conditions. Standing at around 10 inches in height this plucky companion is characterized by a keen alert expression erect ears and a docked tail. Despite its diminutive size the Australian Terrier boasts a bold and confident demeanor making it an excellent watchdog and an adaptable family pet.
basenji,The Basenji often referred to as the "Barkless Dog" traces its roots to Central Africa. This elegant and compact breed is distinguished by its tightly curled tail distinctive forehead wrinkles and a sleek short coat. Known for its independent and intelligent nature the Basenji is an excellent hunter and possesses a unique yodel-like vocalization. As an affectionate yet independent companion the Basenji is well-suited for owners who appreciate its quiet charm and lively spirit.
basset,The Basset Hound with its droopy ears soulful expression and distinctive scenting ability hails from France and is a member of the hound family. Recognizable by its long body and short legs the Basset Hound's charming appearance is complemented by its gentle and friendly temperament. Despite its laid-back demeanor this breed has a keen sense of smell making it an exceptional tracker. With its loving nature the Basset Hound excels as a devoted family pet.
beagle,The Beagle a beloved hound breed originating from England is renowned for its friendly disposition and keen sense of smell. Recognizable by its compact size short coat and expressive eyes the Beagle is a playful and curious companion. Whether used as a hunting partner or cherished family member the Beagle's sociable nature and adaptability make it a popular choice for households of all sizes.
bedlington_terrier,The Bedlington Terrier named after the mining town of Bedlington in Northumberland England boasts a distinctive lamb-like appearance. With its unique topknot and curly coat this terrier exudes elegance and charm. Bred originally for vermin hunting the Bedlington Terrier is also known for its agility and versatility. Underneath its refined exterior lies a spirited and affectionate personality making it a delightful and loyal family companion.
bernese_mountain_dog,The Bernese Mountain Dog originating from Switzerland is a majestic and gentle giant that captivates with its striking tricolor coat which includes black rust and white markings. Known for its strength intelligence and calm demeanor the Bernese Mountain Dog was historically used as a farm and draft dog. Today it excels as a family companion combining a friendly nature with a strong sense of loyalty and a gentle disposition making it a cherished member of many households.
black-russian-terrier,The Black Russian Terrier developed in the Soviet Union is a robust and imposing breed with an all-black coat that contributes to its commanding presence. Originally bred as a working and military dog the Black Russian Terrier is known for its intelligence strength and protective instincts. Beneath its stern exterior lies a loyal and affectionate companion making it a devoted family guard dog.
blenheim_spaniel,The Blenheim Spaniel a member of the Cavalier King Charles Spaniel family is named after Blenheim Palace in England. Recognizable by its distinctive chestnut and white coat this charming breed possesses a friendly and affectionate personality. The Blenheim Spaniel is characterized by its expressive large dark eyes and silky medium-length ears embodying the epitome of a delightful and elegant lapdog that thrives on companionship.
bloodhound,The Bloodhound a member of the hound family boasts an exceptional sense of smell and a distinctive appearance with its loose wrinkled skin and long droopy ears. Originating from Belgium the Bloodhound is known for its tenacity in tracking scents over long distances. Despite its imposing stature this breed is characterized by a gentle and affectionate nature making it an excellent choice for families seeking a patient and loyal companion.
bluetick,The Bluetick Coonhound hailing from the United States is a distinctive and energetic breed with a striking blue mottled coat. Used primarily for hunting raccoons and other game this coonhound exhibits endurance determination and an unmistakable howl. The Bluetick Coonhound's friendly disposition and loyalty make it a well-suited companion for active families and outdoor enthusiasts.
border_collie,The Border Collie originating from the border regions of Scotland and England is a highly intelligent and agile herding dog. Known for its striking appearance marked by a well-balanced body and a flowing double coat the Border Collie excels in various dog sports and activities. Its exceptional work ethic trainability and boundless energy contribute to its reputation as an outstanding herding dog and a beloved family companion.
border_terrier,The Border Terrier a small but sturdy terrier breed from England is recognized for its otter-like head and distinctive wiry coat. This agile and fearless dog was originally bred for fox and vermin hunting. Despite its working background the Border Terrier possesses a friendly and affectionate temperament making it an ideal choice for families seeking a versatile and adaptable canine companion.
borzoi,The Borzoi also known as the Russian Wolfhound is an elegant and regal sighthound originating from Russia. With its long silky coat and slender physique the Borzoi embodies grace and sophistication. Originally bred for coursing game in open fields this breed possesses a gentle and dignified nature. The Borzoi's aristocratic appearance and independent yet affectionate temperament make it a captivating companion for those who appreciate its unique blend of beauty and poise.
boston_bull,The Boston Bull Terrier commonly known as the Boston Terrier is a compact and muscular breed with a distinctive tuxedo-like coat pattern. Originating in the United States the Boston Terrier is characterized by its friendly and amiable temperament. Renowned for its intelligence and adaptability this breed thrives as a lively and affectionate family companion excelling in various activities and forming strong bonds with its human counterparts.
bouvier_des_flandres,The Bouvier des Flandres a robust and powerful herding breed from Belgium commands attention with its distinctive rough coat and imposing presence. Originally developed for herding cattle the Bouvier des Flandres is known for its versatility and adaptability. Despite its imposing appearance this breed is characterized by a calm and steady temperament making it a loyal family guardian and a reliable working dog.
boxer,The Boxer a medium to large breed originating from Germany is recognized for its square jaw strong physique and energetic demeanor. With a smooth short coat and a distinctive underbite the Boxer combines strength with agility. Renowned for its playful and affectionate nature this breed excels as a family companion demonstrating loyalty intelligence and a boundless enthusiasm for life.
brabancon_griffon,The Brabancon Griffon originating from Belgium is a small toy breed renowned for its endearing facial features including a wiry beard and prominent eyebrows contributing to its lively and inquisitive expression; with a history rooted in ratting and as a companion to cab drivers this charming canine brings forth not only a quirky charm but also an affectionate temperament making it an ideal choice for those seeking a delightful and devoted companion with a distinct sense of character.
briard,The Briard a versatile herding breed hailing from France is a majestic canine with an impressive double coat distinctive bushy eyebrows and a history steeped in herding livestock; known for its intelligence and agility the Briard effortlessly combines steadfast loyalty with gentleness making it an exceptional working dog as well as a devoted family member adding an element of dignity and protection to its multifaceted personality.
brittany_spaniel,The Brittany Spaniel a vivacious gundog originating from France stands out for its distinctive orange and white coat showcasing a lively and outgoing nature that complements its keen hunting instincts; embodying both a tireless working dog and an affectionate family member the Brittany Spaniel brings an energetic charm to households making it an ideal choice for those who appreciate an active and engaging canine companion.
bull_mastiff,The Bull Mastiff a formidable British breed captivates with its muscular build wrinkled face and gentle yet protective nature; originally bred as a steadfast guardian this breed seamlessly combines strength with loyalty excelling as a reliable protector and a devoted family companion bringing forth a harmonious blend of power and warmth.
cairn,The Cairn Terrier originating from Scotland is a small yet sturdy breed with a shaggy coat expressive ears and an adventurous spirit; known for its plucky nature and loyalty the Cairn Terrier despite its size embodies resilience and affection making it a spirited and delightful companion for those who appreciate a tenacious and affectionate canine friend.
cardigan,The Cardigan Welsh Corgi a herding breed hailing from Wales distinguishes itself with its expressive face large ears and fluffy tail; known for its intelligence and agility this breed effortlessly combines tireless herding skills with a friendly disposition making it not only an adept worker but also a charming and devoted family companion that leaves a lasting impression.
chesapeake_bay_retriever,The Chesapeake Bay Retriever an American breed rooted in Maryland's waters is recognized for its distinctive waterproof coat webbed feet and tireless work ethic; excelling as a versatile waterfowl retriever with a protective yet gentle nature this breed showcases loyalty and intelligence making it an exceptional working dog and a devoted family member with an affinity for water activities.
chihuahua,The Chihuahua a small and spirited toy breed originating from Mexico captivates with its diminutive size large eyes and confident personality; embodying a bold and lively spirit that often contrasts with its tiny stature the Chihuahua is a cherished companion for those seeking a pocket-sized but tenacious canine friend adding a touch of vivacity to households.
chow,The Chow Chow an ancient Chinese breed exudes an aloof and regal demeanor characterized by its lion-like mane and distinctive blue-black tongue; with a unique blend of loyalty independence and a dignified presence the Chow Chow stands as a formidable yet exotic companion offering both a striking appearance and protective instincts to those who appreciate its distinct charm.
clumber,The Clumber Spaniel a robust gundog originating from England is recognized for its large heavyset build distinctive white coat with lemon or orange markings and a calm laid-back nature; excelling as both a skilled hunting partner and a relaxed affectionate family companion the Clumber Spaniel adds a touch of elegance and versatility to households.
cocker_spaniel,The Cocker Spaniel a beloved and versatile breed is known for its expressive eyes luxurious coat and joyful disposition; epitomizing a combination of intelligence affection and adaptability the Cocker Spaniel excels not only as a skilled hunting dog but also as a delightful and loyal family member bringing forth a charismatic charm and sociable nature.
collie,The Collie a graceful and intelligent herding breed from Scotland is recognized for its striking double coat distinctive mane and a gentle yet protective nature; embodying loyalty sensitivity and keen intelligence the Collie has earned its place as a beloved family companion and a cultural icon symbolized by the fictional character Lassie representing an enduring legacy of devotion and elegance.
curly-croated_retriver,The Curly-Coated Retriever an English breed with distinctively tight curls covering its waterproof coat stands out for its athleticism endurance and an independent yet friendly temperament; excelling as a waterfowl retriever this spirited companion thrives on adventure and activity showcasing a unique combination of resilience and companionship.
dandie_dinmont,The Dandie Dinmont Terrier named after a fictional character in Sir Walter Scott's novels is a distinctive small breed from Scotland recognized for its long body distinctive topknot and a brave yet charming demeanor; making its mark as a delightful and unique companion the Dandie Dinmont Terrier captures hearts with its individuality and affectionate nature adding a touch of character to households.
dhole,The Dhole also known as the Asiatic Wild Dog is a highly social and agile canid species native to Asia characterized by its reddish-brown coat bushy tail and cooperative hunting strategy within tight-knit packs; exemplifying both independence and adaptability the Dhole serves as a testament to its survival instincts in the diverse landscapes of its native habitat contributing to the intricate balance of its ecosystems.
dingo,The Dingo a wild dog indigenous to Australia showcases a lean and agile build a bushy tail and distinctive coat coloration; embodying independence and adaptability the Dingo thrives in the challenging Australian landscape serving as a testament to its ability to survive and thrive for thousands of years contributing to the unique ecological tapestry of the continent.
doberman,The Doberman Pinscher a German breed created by tax collector Louis Dobermann is characterized by its sleek and muscular appearance cropped ears and a determined yet loyal temperament; excelling as a protective guardian and a disciplined working dog the Doberman seamlessly blends elegance with intelligence and steadfast loyalty making it a formidable yet dignified companion.
english_foxhound,The English Foxhound a classic and elegant breed traces its origins to England and is a renowned scent hound developed primarily for fox hunting. Characterized by a strong and athletic build a short dense coat and long ears that frame its noble face the English Foxhound is a pack-oriented and sociable canine known for its friendly disposition keen sense of smell and endurance in the field. As a member of the hound family it thrives on regular exercise and benefits from an environment where its hunting instincts can be engaged.
english_setter,The English Setter an aristocratic and versatile gundog breed originating from England is celebrated for its distinctive feathered coat elegant feathering on the ears and a friendly outgoing temperament. Known for its exceptional pointing ability and keen sense of smell the English Setter is not only an adept hunter but also a gentle and affectionate family companion excelling in both the field and as a loyal household member.
english_springer,The English Springer Spaniel a versatile and energetic breed with roots in England is characterized by its compact build distinctive coat markings and an expressive face. Renowned for its boundless energy and enthusiasm the English Springer Spaniel is not only a skilled hunting companion adept at flushing game but also a delightful and affectionate family member displaying intelligence agility and a playful spirit.
entlebucher,The Entlebucher Mountain Dog hailing from Switzerland is a robust and compact breed recognized for its tricolor coat and striking symmetrical markings. As the smallest of the Swiss Mountain Dogs the Entlebucher is known for its versatility as a herder watchdog and loyal family companion. With a confident and alert demeanor this breed combines agility with intelligence making it a capable and devoted canine companion.
eskimo_dog,The Eskimo Dog also known as the American Eskimo Dog is a member of the Spitz family with origins in Germany. Distinguished by its thick double coat plume-like tail and fox-like face this breed comes in three size varieties: Toy Miniature and Standard. Known for its intelligence agility and social nature the Eskimo Dog excels in various dog sports and activities making it not only a beautiful companion but also a versatile and trainable one.
flat_coated_retriever,Flat-Coated Retrievers are known for their exuberant and friendly personality. Among the retriever breeds they have a distinctive sleek black or liver-colored coat and a love for water activities.
french_bulldog,The French Bulldog a delightful and affectionate breed is renowned for its bat-like ears compact build and charming expression. Originating from France the French Bulldog is a companion dog with a friendly and adaptable nature making it well-suited for apartment living. Despite its small size this breed has a sturdy build and a distinctive "bat ear" appearance capturing the hearts of many with its endearing personality and unique charm.
german_shepherd,The German Shepherd a versatile and intelligent working breed originated in Germany and is renowned for its loyalty courage and versatility. Recognized for its iconic appearance including erect ears and a bushy tail the German Shepherd excels in various roles including police and military work search and rescue and as a loyal family protector. Known for its trainability and keen intelligence this breed is characterized by a strong work ethic and an innate desire to serve.
german_short-haired_pointer,The German Shorthaired Pointer a highly versatile hunting breed hailing from Germany is distinguished by its sleek coat athletic build and distinctive liver or black markings. Renowned for its versatility in pointing retrieving and tracking the German Shorthaired Pointer is not only a skilled hunting companion but also a loyal and affectionate family member showcasing a combination of intelligence energy and social nature.
giant_schnauzer,The Giant Schnauzer a robust and imposing breed from Germany is recognized for its powerful build distinctive beard and eyebrows and a bold yet loyal temperament. Originally developed for herding and guarding the Giant Schnauzer is known for its intelligence and versatility excelling as a working dog watchdog and loyal family protector showcasing a unique blend of strength agility and companionship.
golden_retriever,The Golden Retriever a beloved and popular breed hails from Scotland and is characterized by its luscious golden coat friendly expression and a gentle affectionate nature. Renowned for its intelligence versatility and friendly disposition the Golden Retriever excels as a family companion therapy dog and in various canine sports showcasing a unique blend of loyalty adaptability and a love for human interaction.
gordon_setter,The Gordon Setter a dignified and powerful breed originating from Scotland is distinguished by its luscious black and tan coat feathered tail and a confident yet gentle demeanor. Known for its excellent hunting and pointing abilities the Gordon Setter is also a devoted and affectionate family companion embodying both elegance and athleticism making it an ideal choice for those seeking a versatile and loyal canine partner.
great_dane,The Great Dane often referred to as the "gentle giant" is a colossal and majestic breed with roots in Germany. Recognized for its towering stature muscular build and expressive face the Great Dane combines strength with elegance excelling as both a loyal family companion and a gentle giant. Despite its imposing size this breed is known for its friendly and sociable nature making it a beloved and affectionate addition to households.
great_pyrenees,The Great Pyrenees a majestic and noble breed with origins in the Pyrenees Mountains is distinguished by its thick white coat imposing stature and a calm yet protective demeanor. Renowned for its livestock guarding abilities the Great Pyrenees is also a gentle and devoted family protector embodying a unique blend of serenity loyalty and a strong sense of duty making it an exceptional working dog and a cherished household guardian.
greater_swiss_mountain_dog,The Greater Swiss Mountain Dog a robust and powerful breed from Switzerland is recognized for its tri-color coat distinctive markings and a calm gentle demeanor. Originally developed for herding and pulling carts the Greater Swiss Mountain Dog excels as a versatile working dog and a loyal family companion combining strength with an affectionate nature making it an ideal choice for those seeking a devoted and sturdy canine friend.
groenendael,The Groenendael one of the four varieties of Belgian Shepherd Dogs is a graceful and intelligent breed originating from Belgium. Known for its luxurious black coat elegant appearance and a keen intelligence the Groenendael excels in various dog sports including obedience and agility. With a loyal and protective nature this breed is not only a versatile working dog but also a devoted family companion showcasing an ideal balance of beauty and functionality.
ibizan_hound,The Ibizan Hound an ancient and elegant breed from Spain is distinguished by its sleek muscular build large erect ears and a distinctive coat. Renowned for its exceptional hunting and tracking abilities the Ibizan Hound is also a gentle and affectionate companion showcasing a unique combination of athleticism and grace making it an ideal choice for those seeking a versatile and loyal canine partner.
irish_setter,The Irish Setter a flamboyant and sociable breed from Ireland is recognized for its rich chestnut or mahogany coat flowing feathering and an outgoing friendly temperament. Known for its exceptional hunting and retrieving abilities the Irish Setter is also a vibrant and affectionate family companion embodying a unique blend of elegance energy and loyalty making it an ideal choice for those seeking an active and engaging canine friend.
irish_terrier,The Irish Terrier a spirited and tenacious breed from Ireland is distinguished by its wiry red coat and a confident yet friendly demeanor. Recognized for its versatility as a hunter guardian and companion the Irish Terrier is known for its intelligence courage and loyalty. Despite its compact size this breed exudes a bold and spirited personality making it an ideal choice for those seeking a spirited and devoted canine companion.
irish_water_spaniel,The Irish Water Spaniel a distinctive and versatile breed from Ireland is recognized for its curly water-resistant coat distinctive "rat tail" and an intelligent yet playful temperament. Renowned for its exceptional swimming abilities the Irish Water Spaniel is not only a skilled waterfowl retriever but also a loving and spirited family companion showcasing a unique blend of athleticism and affection making it an ideal choice for those who appreciate both versatility and charm.
irish_wolfhound,The Irish Wolfhound a majestic and gentle giant is one of the tallest dog breeds with its origins in Ireland. Characterized by its impressive stature rough wiry coat and a calm friendly demeanor the Irish Wolfhound is not only an imposing sight but also a sweet-natured and affectionate family companion. Originally bred for hunting wolves and other large game this breed embodies both strength and gentleness making it a beloved member of households seeking a noble and loyal canine friend.
italian_greyhound,The Italian Greyhound a sleek and slender toy breed traces its roots to ancient Egypt and is renowned for its elegant appearance fine coat and graceful demeanor. Characterized by its slender build large expressive eyes and a distinctive curve to its back the Italian Greyhound is not only an aesthetically pleasing companion but also a charming and affectionate member of the family excelling in agility and showcasing a playful spirit.
