breed,interesting
japanese_spaniel,The Japanese Chin also known as the Japanese Spaniel is an ancient toy breed originating from Asia characterized by its distinctive pushed-in face large expressive eyes and a silky flowing coat. Revered for its regal appearance and charming personality the Japanese Chin is not only a delightful lapdog but also a loyal and affectionate companion showcasing a unique blend of elegance and playfulness.
keeshond,The Keeshond a spitz-type breed originating from the Netherlands is known for its distinctive "fox-like" expression dense double coat and plume-like tail. Recognized for its intelligence agility and friendly demeanor the Keeshond is not only a skilled watchdog but also a loyal and loving family companion embodying a unique combination of alertness and sociability.
kelpie,The Australian Kelpie often referred to as the Kelpie is a highly intelligent and agile herding breed from Australia. Recognized for its versatility the Kelpie excels in herding livestock and has a distinct appearance including a short weather-resistant coat and an alert expression. Known for its boundless energy and work ethic the Australian Kelpie is not only an exceptional working dog but also a loyal and spirited family companion.
kerry_blue_terrier,The Kerry Blue Terrier originating from Ireland is a distinctive terrier breed known for its unique blue coat non-shedding qualities and a playful yet confident temperament. Recognized for its versatility as a hunter guardian and family companion the Kerry Blue Terrier embodies a spirited and affectionate nature making it an ideal choice for those seeking an energetic and devoted canine friend.
komondor,The Komondor a Hungarian breed with a unique corded coat is known for its distinctive appearance resembling dreadlocks and a strong muscular build. Originally developed for guarding livestock the Komondor is characterized by its calm and protective nature making it an excellent guardian and a devoted family companion showcasing both elegance and strength.
kuvasz,The Kuvasz a Hungarian breed with a majestic and dignified appearance is known for its dense white double coat and a confident yet gentle demeanor. Historically used as a royal guard dog the Kuvasz is not only a loyal protector but also a devoted family companion showcasing intelligence independence and a strong sense of loyalty.
labrador_retriever,The Labrador Retriever a popular and versatile breed hails from Newfoundland and is celebrated for its friendly nature intelligence and exceptional retrieving abilities. Recognized for its sturdy build distinctive otter-like tail and a short water-resistant coat the Labrador Retriever is not only an ideal family companion but also excels as a service dog search and rescue dog and in various canine sports showcasing a unique blend of versatility and affection.
lakeland_terrier,The Lakeland Terrier a small and agile terrier breed originating from the Lake District in England is known for its distinctive "fall" or longer hair on the head and a lively yet confident temperament. Recognized for its versatility as a hunter vermin controller and spirited family companion the Lakeland Terrier embodies a plucky and affectionate nature making it an ideal choice for those seeking a compact and spirited canine companion.
leonberg,The Leonberger a noble giant originating from Germany is a distinctive breed known for its regal appearance lion-like mane and a gentle affectionate nature. Recognized for its versatility the Leonberger excels in various roles including working dog therapy dog and cherished family companion. With a massive yet graceful build this breed embodies both strength and warmth making it a wonderful addition to households seeking a majestic and devoted canine friend. Historically Leonbergers were bred as a status symbol and today they continue to captivate hearts with their imposing yet friendly presence.
lhasa,The Lhasa Apso an ancient and revered breed from Tibet is characterized by its long flowing double coat distinctive topknot and a spirited yet dignified temperament. Originally bred as palace guard dogs Lhasa Apsos are known for their alertness and loyalty. Despite their small size they exude confidence and make excellent watchdogs. As companions Lhasa Apsos bring a touch of elegance and independence making them an ideal choice for those who appreciate a spirited yet regal canine companion with a rich cultural heritage.
malamute,The Alaskan Malamute a robust and powerful Arctic breed is renowned for its wolf-like appearance dense double coat and friendly outgoing nature. Developed by the native Inuit people for hauling heavy freight in harsh Arctic conditions the Malamute is known for its strength endurance and teamwork. Despite its independent streak this breed is also a loyal and affectionate family companion making it an ideal choice for those seeking a capable and devoted canine friend with a strong sense of heritage.
malinois,The Belgian Malinois an intelligent and versatile herding breed is one of the varieties of the Belgian Shepherd Dogs. Distinguished by its sleek fawn coat and a confident alert demeanor the Malinois is celebrated for its work ethic and has excelled in roles such as police and military work search and rescue and loyal family protection. With sharp intelligence and agility this breed embodies both versatility and loyalty making it a respected and capable working dog that is also a cherished member of the family.
maltese_dog,The Maltese a charming toy breed with Mediterranean origins is characterized by its long silky white coat expressive eyes and a lively affectionate temperament. Known for its elegance and portability the Maltese is not only a delightful lapdog but also a spirited and sociable family companion. With a rich history that includes being favored by royalty and nobility the Maltese brings a touch of luxury and companionship to households making it an ideal choice for those seeking a small yet glamorous canine friend.
mexican_hairless,The Mexican Hairless Dog also known as the Xoloitzcuintli or Xolo is an ancient breed from Mexico distinguished by its hairless coat a compact build and a calm yet alert temperament. Revered in ancient cultures for its sacred status the Mexican Hairless Dog is not only a unique and exotic companion but also a loyal and affectionate family member. With a distinctive appearance and a deep connection to history the Xoloitzcuintli brings a touch of mystique and companionship to households making it an ideal choice for those seeking a canine friend with a rich cultural heritage.
miniature_pinscher,The Miniature Pinscher often referred to as the "Min Pin" is a spirited and compact toy breed with German origins. Known for its sleek coat distinctive "hackney-like" gait and a lively assertive personality the Miniature Pinscher is a fearless and energetic dog. Despite its small size this breed excels in various canine sports and showcases a vibrant spirit making it an ideal choice for those seeking a dynamic and entertaining canine companion that packs a punch of energy and personality.
miniature_poodle,The Miniature Poodle one of the varieties of the Poodle breed is characterized by its curly or corded coat distinctive grooming styles and an intelligent affectionate temperament. Recognized for its versatility and trainability the Miniature Poodle excels in various dog sports and activities. Beyond its grooming prowess this breed serves as a loyal family companion showcasing a unique blend of elegance and intelligence making it an ideal choice for those seeking a sophisticated and adaptable canine friend.
miniature_schnauzer,The Miniature Schnauzer a small and spirited terrier breed from Germany is distinguished by its distinctive beard and eyebrows wiry coat and a confident yet friendly demeanor. Recognized for its versatility as a vermin hunter and loyal family companion the Miniature Schnauzer embodies both pluckiness and affection. With a spirited personality and a distinctive appearance this breed makes a charming and spirited addition to households bringing a mix of spunk and companionship.
newfoundland,The Newfoundland a gentle giant with its roots in Canada is characterized by its massive size thick water-resistant coat and a calm sweet temperament. Recognized for its exceptional swimming abilities and strength the Newfoundland excels in water rescue work and is a cherished family companion. With a unique blend of gentleness and strength this breed makes an ideal choice for those seeking a loving and capable canine friend that is not only impressive in size but also gentle in demeanor making it a wonderful addition to households.
norfolk_terrier,The Norfolk Terrier a charming and spirited terrier breed originated in England and is characterized by its compact size wiry coat and an outgoing yet affectionate nature. Known for its bold personality and friendly demeanor the Norfolk Terrier is not only a skilled vermin hunter but also a delightful and loyal family companion making it an ideal choice for those seeking a small yet plucky canine friend that brings a dash of exuberance to households.
norwegian_elkhound,The Norwegian Elkhound a robust and versatile breed from Norway is recognized for its wolf-like appearance thick double coat and a courageous yet friendly temperament. Traditionally used for hunting large game the Norwegian Elkhound is not only a skilled tracker but also a loyal and protective family companion showcasing a unique blend of strength and loyalty making it an ideal choice for those seeking a capable and devoted canine friend with a strong sense of heritage.
norwich_terrier,The Norwich Terrier closely related to the Norfolk Terrier is a small yet tenacious breed originating from England. Known for its alert expression prick ears and a sturdy build the Norwich Terrier is both a skilled vermin hunter and a spirited family companion. With a confident and outgoing personality this breed brings a touch of spunk and affection to households making it an ideal choice for those seeking a lively and devoted canine friend.
old_english_sheepdog,The Old English Sheepdog a distinctive and shaggy herding breed originated in England and is known for its iconic "Bobtail" appearance dense double coat and an amiable yet independent nature. Recognized for its herding abilities and charming demeanor the Old English Sheepdog is not only a skilled working dog but also a lovable and devoted family companion adding a touch of whimsy and warmth to households.
otterhound,The Otterhound an ancient and large scent hound breed from England is characterized by its distinctive webbed feet dense double coat and a friendly yet determined temperament. Renowned for its excellent tracking abilities the Otterhound was historically used for hunting otters. Despite its rare status this breed is a charming and affectionate companion showcasing a unique blend of determination and warmth that makes it an ideal choice for those seeking a distinctive and devoted canine friend.
papillon,The Papillon a toy breed with its roots in France is recognized for its butterfly-like ears fine coat and an alert friendly temperament. Known for its elegance and intelligence the Papillon excels in various dog sports and activities. Despite its small size this breed is not only a skilled performer but also a loving and vivacious family companion bringing a touch of charm and agility to households.
pekinese,The Pekingese an ancient toy breed with its origins in China is distinguished by its distinctive lion-like mane compact build and a dignified yet affectionate nature. Revered as a symbol of royalty in Chinese history the Pekingese is not only a regal and elegant companion but also a loyal and devoted family member adding a touch of sophistication and warmth to households.
pembroke,The Pembroke Welsh Corgi a herding breed from Wales is recognized for its distinctive short legs long body and a cheerful affectionate temperament. Known for its intelligence and agility the Pembroke Welsh Corgi excels in herding and various dog sports. With a spirited personality and a strong work ethic this breed is not only a skilled worker but also a delightful and loyal family companion bringing a mix of charm and loyalty to households.
pomeranian,The Pomeranian a toy breed with its roots in Pomerania (now part of Poland and Germany) is characterized by its fluffy double coat fox-like face and a lively yet affectionate nature. Known for its vivacity and charm the Pomeranian is not only a delightful lapdog but also a spirited and loving family companion showcasing a unique blend of elegance and playfulness.
pug,The Pug a distinctive toy breed with its origins in China is recognized for its wrinkled face curled tail and a charming yet mischievous personality. Revered for its friendly and adaptable nature the Pug is not only a delightful companion but also a loving and affectionate family member adding a touch of warmth and humor to households.
redbone,The Redbone Coonhound a sleek and athletic hunting breed from the United States is known for its distinctive red coat long ears and a friendly yet determined temperament. Renowned for its tracking abilities the Redbone Coonhound is not only a skilled hunter but also a loyal and affectionate family companion showcasing a unique combination of athleticism and devotion making it an ideal choice for those seeking a versatile and loving canine friend.
rhodesian_ridgeback,The Rhodesian Ridgeback a striking and athletic breed from Southern Africa is recognized for the distinctive "ridge" along its back short coat and a confident yet gentle nature. Originally developed for hunting large game the Rhodesian Ridgeback is not only a skilled tracker but also a loyal and protective family companion showcasing a unique blend of strength and affection making it an ideal choice for those seeking a versatile and devoted canine friend.
rottweiler,The Rottweiler a powerful and confident working breed from Germany is known for its robust build distinctive black and tan coat and a loyal yet protective temperament. Renowned for its versatility as a police and military dog search and rescue worker and loyal family protector the Rottweiler embodies strength and loyalty making it an ideal choice for those seeking a formidable yet devoted canine friend.
saint_bernard,The Saint Bernard a gentle giant from the Swiss Alps is recognized for its massive size distinctive head markings and a calm gentle temperament. Historically used for rescue work in the Alps the Saint Bernard is not only a formidable working dog but also a lovable and affectionate family companion showcasing a unique combination of strength and warmth making it an ideal choice for those seeking a loving and capable canine friend.
saluki,The Saluki an ancient sighthound breed from the Middle East is characterized by its slender build sleek coat and a regal yet independent temperament. Revered for its exceptional speed and endurance the Saluki is not only a skilled hunter but also a graceful and loyal family companion showcasing a unique blend of elegance and loyalty making it an ideal choice for those seeking a sleek and devoted canine friend.
samoyed,The Samoyed a fluffy and friendly spitz-type breed from Siberia is known for its thick white double coat distinctive "Sammy smile" and an amiable yet independent nature. Historically used by the Samoyede people for herding and pulling sleds the Samoyed is not only a versatile working dog but also a charming and affectionate family companion bringing a touch of warmth and elegance to households.
schipperke,The Schipperke a small and spirited breed from Belgium is recognized for its distinctive fox-like face thick double coat and a lively yet independent personality. Known for its agility and agility the Schipperke is not only a skilled watchdog but also a spirited and loyal family companion showcasing a unique blend of boldness and affection making it an ideal choice for those seeking a compact and vivacious canine friend.
scotch_terrier,The Scottish Terrier a small and sturdy breed from Scotland is characterized by its distinctive beard and eyebrows erect ears and a determined yet friendly demeanor. Known for its tenacity and loyalty the Scottish Terrier is not only a skilled vermin hunter but also a spirited and affectionate family companion adding a touch of spunk and charm to households.
scottish_deerhound,The Scottish Deerhound a majestic and dignified breed from Scotland is recognized for its tall slender build distinctive wiry coat and a gentle yet dignified nature. Historically used for hunting deer in the Scottish Highlands the Scottish Deerhound is not only a formidable hunter but also a gentle and affectionate family companion showcasing a unique blend of grace and strength making it an ideal choice for those seeking an elegant and devoted canine friend.
sealyham_terrier,The Sealyham Terrier a small yet sturdy terrier breed from Wales is characterized by its distinctive coat compact build and a determined yet charming temperament. Originally bred for hunting small game the Sealyham Terrier is not only a skilled vermin hunter but also a spirited and affectionate family companion showcasing a unique blend of tenacity and warmth making it an ideal choice for those seeking a compact and spirited canine friend with a dash of Welsh charm.
shetland_sheepdog,The Shetland Sheepdog a herding breed from the Shetland Islands in Scotland is recognized for its long flowing double coat mane-like ruff and an intelligent yet gentle nature. Known for its herding abilities and versatility the Shetland Sheepdog is not only a skilled working dog but also a loving and devoted family companion bringing a mix of agility and loyalty to households making it an ideal choice for those seeking a charming and intelligent canine friend.
shih-tzu,The Shih Tzu an ancient toy breed with its origins in China is known for its distinctive long flowing coat pushed-in face and a dignified yet friendly personality. Revered as a companion to Chinese royalty the Shih Tzu is not only a regal and elegant lapdog but also a lovable and affectionate family member adding a touch of grace and warmth to households.
siberian_husky,The Siberian Husky a striking and athletic breed from Siberia is recognized for its thick double coat erect triangular ears and a friendly yet independent temperament. Historically used as sled dogs by the Chukchi people the Siberian Husky is not only a versatile working dog but also a spirited and loyal family companion showcasing a unique combination of strength and sociability making it an ideal choice for those seeking a capable and friendly canine friend.
silky_terrier,The Silky Terrier a small and elegant terrier breed from Australia is characterized by its silky flowing coat perky ears and a lively yet affectionate nature. Known for its agility and charm the Silky Terrier is not only a skilled vermin hunter but also a delightful and loving family companion showcasing a unique blend of vivacity and elegance making it an ideal choice for those seeking a small and spirited canine friend.
soft-coated_wheaten_terrier,The Soft-Coated Wheaten Terrier a medium-sized terrier breed from Ireland is recognized for its soft silky coat friendly expression and an energetic yet gentle temperament. Traditionally used as a versatile farm dog the Soft-Coated Wheaten Terrier is not only a skilled vermin hunter but also a lovable and spirited family companion adding a mix of warmth and vitality to households.
staffordshire_bullterrier,The Staffordshire Bull Terrier a muscular and agile breed from England is characterized by its distinct appearance stocky build and a friendly yet determined personality. Known for its strength and loyalty the Staffordshire Bull Terrier is not only a formidable working dog but also a loving and affectionate family companion showcasing a unique blend of tenacity and warmth making it an ideal choice for those seeking a strong yet gentle canine friend.
standard_poodle,The Standard Poodle one of the varieties of the Poodle breed is characterized by its curly or corded coat distinctive grooming styles and an intelligent affectionate temperament. Recognized for its versatility and trainability the Standard Poodle excels in various dog sports and activities. Beyond its grooming prowess this breed serves as a loyal family companion showcasing a unique blend of elegance and intelligence making it an ideal choice for those seeking a sophisticated and adaptable canine friend.
standard_schnauzer,The Standard Schnauzer a medium-sized terrier breed from Germany is distinguished by its distinctive beard and eyebrows wiry coat and a confident yet friendly demeanor. Recognized for its versatility as a vermin hunter and loyal family companion the Standard Schnauzer embodies both pluckiness and affection. With a spirited personality and a distinctive appearance this breed makes a charming and spirited addition to households bringing a mix of spunk and companionship.
sussex_spaniel,The Sussex Spaniel a compact and cheerful spaniel breed from England is recognized for its distinctive golden liver coat long ears and a friendly yet determined temperament. Originally bred for flushing game the Sussex Spaniel is not only a skilled hunter but also a lovable and devoted family companion showcasing a unique blend of charm and determination making it an ideal choice for those seeking a cheerful and affectionate canine friend.
tibetan_mastiff,The Tibetan Mastiff a majestic and independent breed from Tibet is characterized by its thick double coat mane-like ruff and a dignified yet aloof temperament. Historically used as a guardian of livestock in the Himalayas the Tibetan Mastiff is not only a formidable protector but also a loyal and reserved family companion showcasing a unique combination of strength and independence making it an ideal choice for those seeking a majestic and self-assured canine friend.
tibetan_terrier,The Tibetan Terrier a medium-sized companion breed from Tibet is recognized for its long flowing double coat friendly expression and an agile yet affectionate temperament. Despite its name the Tibetan Terrier is not a terrier but was traditionally kept by Tibetan monasteries. This breed is not only a delightful companion but also a spirited and loving family member showcasing a unique blend of agility and warmth making it an ideal choice for those seeking a charming and adaptable canine friend.
toy_poodle,The Toy Poodle one of the varieties of the Poodle breed is characterized by its curly or corded coat distinctive grooming styles and an intelligent affectionate temperament. Recognized for its versatility and trainability the Toy Poodle excels in various dog sports and activities. Beyond its grooming prowess this breed serves as a charming and loyal family companion showcasing a unique blend of elegance and intelligence making it an ideal choice for those seeking a sophisticated and portable canine friend.
toy_terrier,The Toy Terrier a small and spirited toy breed is characterized by its compact size lively personality and a fearless yet affectionate temperament. Known for its agility and charm the Toy Terrier is not only a skilled vermin hunter but also a delightful and loving family companion showcasing a unique blend of vivacity and elegance making it an ideal choice for those seeking a small and spirited canine friend.
vizsla,The Vizsla a sleek and athletic hunting breed from Hungary is known for its distinctive golden-rust coat lean build and a friendly yet energetic nature. Renowned for its versatility as a pointer and retriever the Vizsla is not only a skilled hunting dog but also a loyal and affectionate family companion showcasing a unique blend of athleticism and warmth making it an ideal choice for those seeking a versatile and loving canine friend.
walker_hound,The Walker Hound a type of coonhound used primarily for hunting is characterized by its sleek coat long ears and a determined yet sociable temperament. Known for its exceptional tracking abilities the Walker Hound is not only a skilled hunter but also a loyal and friendly family companion showcasing a unique combination of determination and sociability making it an ideal choice for those seeking a capable and affectionate canine friend.
weimaraner,The Weimaraner a sleek and athletic breed from Germany is recognized for its distinctive silver-gray coat amber eyes and a friendly yet energetic temperament. Historically used for hunting large game the Weimaraner is not only a skilled hunter but also a loyal and affectionate family companion showcasing a unique blend of athleticism and warmth making it an ideal choice for those seeking a versatile and loving canine friend.
welsh_springer_spaniel,The Welsh Springer Spaniel a compact and cheerful spaniel breed from Wales is recognized for its distinctive red and white coat long ears and a friendly yet determined temperament. Originally bred for flushing game the Welsh Springer Spaniel is not only a skilled hunter but also a lovable and devoted family companion showcasing a unique blend of charm and determination making it an ideal choice for those seeking a cheerful and affectionate canine friend.
west_highland_white_terrier,The West Highland White Terrier or Westie is a small and sturdy terrier breed from Scotland characterized by its distinctive white coat pointed ears and a spirited yet friendly temperament. Known for its agility and charm the West Highland White Terrier is not only a skilled vermin hunter but also a delightful and affectionate family companion showcasing a unique blend of vivacity and elegance making it an ideal choice for those seeking a small and spirited canine friend.
